{
  "$schema": "https://json-schema.org/draft/2020-12/schema",
  "$id": "https://example.org/schemas/security-review.config.schema.json",
  "title": "SecurityReviewConfig",
  "type": "object",
  "additionalProperties": false,
  "properties": {
    "enabledLayers": {
      "type": "array",
      "items": {
        "type": "string",
        "enum": [
          "edit",
          "turn",
          "commit",
          "push"
        ]
      }
    },
    "debug": {
      "type": "boolean"
    },
    "caps": {
      "type": "object",
      "additionalProperties": false,
      "properties": {
        "maxDiffBytes": {
          "type": "integer",
          "minimum": 1
        },
        "maxChangedFiles": {
          "type": "integer",
          "minimum": 1
        },
        "maxCustomPatterns": {
          "type": "integer",
          "minimum": 1
        },
        "maxSuppressions": {
          "type": "integer",
          "minimum": 1
        }
      }
    },
    "turnReview": {
      "type": "object",
      "additionalProperties": false,
      "properties": {
        "enabled": {
          "type": "boolean"
        },
        "provider": {
          "type": [
            "string",
            "null"
          ]
        },
        "model": {
          "type": [
            "string",
            "null"
          ]
        },
        "minSeverityToBlock": {
          "type": "string",
          "enum": [
            "low",
            "medium",
            "high",
            "critical"
          ]
        },
        "maxModelDiffBytes": {
          "type": "integer",
          "minimum": 1024
        },
        "maxPromptChars": {
          "type": "integer",
          "minimum": 1024
        },
        "maxModelFindings": {
          "type": "integer",
          "minimum": 1
        },
        "timeoutMs": {
          "type": "integer",
          "minimum": 1000
        },
        "command": {
          "type": [
            "object",
            "null"
          ],
          "additionalProperties": false,
          "properties": {
            "id": {
              "type": "string"
            },
            "executable": {
              "type": "string"
            },
            "args": {
              "type": "array",
              "items": {
                "type": "string"
              }
            },
            "maxOutputBytes": {
              "type": "integer",
              "minimum": 1024
            }
          }
        },
        "commandAllowlist": {
          "type": "array",
          "items": {
            "type": "object",
            "additionalProperties": false,
            "required": [
              "id",
              "executable"
            ],
            "properties": {
              "id": {
                "type": "string"
              },
              "executable": {
                "type": "string"
              }
            }
          }
        }
      }
    },
    "checkpointReview": {
      "type": "object",
      "additionalProperties": false,
      "properties": {
        "enabledAdjacentContext": {
          "type": "boolean"
        },
        "maxContextFiles": {
          "type": "integer",
          "minimum": 0
        },
        "maxContextBytes": {
          "type": "integer",
          "minimum": 1024
        },
        "maxAdjacentSearchDepth": {
          "type": "integer",
          "minimum": 0
        }
      }
    },
    "repoGuidance": {
      "type": "array",
      "items": {
        "type": "string"
      }
    },
    "customPatterns": {
      "type": "array",
      "items": {
        "type": "object",
        "additionalProperties": false,
        "required": [
          "id",
          "title",
          "regex",
          "severity"
        ],
        "properties": {
          "id": {
            "type": "string"
          },
          "title": {
            "type": "string"
          },
          "regex": {
            "type": "string"
          },
          "severity": {
            "type": "string",
            "enum": [
              "low",
              "medium",
              "high",
              "critical"
            ]
          },
          "pathRegex": {
            "type": "string"
          }
        }
      }
    },
    "suppressions": {
      "type": "array",
      "items": {
        "type": "object",
        "additionalProperties": false,
        "required": [
          "ruleId",
          "owner",
          "justification"
        ],
        "properties": {
          "ruleId": {
            "type": "string"
          },
          "pathRegex": {
            "type": "string"
          },
          "owner": {
            "type": "string"
          },
          "justification": {
            "type": "string"
          },
          "expiresOn": {
            "type": "string",
            "pattern": "^\\d{4}-\\d{2}-\\d{2}$"
          },
          "approvedBy": {
            "type": "string"
          },
          "ticket": {
            "type": "string"
          },
          "createdOn": {
            "type": "string",
            "pattern": "^\\d{4}-\\d{2}-\\d{2}$"
          },
          "scope": {
            "type": "string",
            "enum": ["file", "repository"],
            "default": "file"
          }
        }
      }
    },
    "modes": {
      "type": "object",
      "additionalProperties": false,
      "properties": {
        "review": {
          "type": "object",
          "additionalProperties": false,
          "properties": {
            "scope": {
              "type": "string",
              "enum": ["changed-files", "full-diff", "all"],
              "default": "changed-files"
            },
            "failOn": {
              "type": "array",
              "items": {
                "type": "string",
                "enum": ["info", "low", "medium", "high", "critical"]
              }
            }
          }
        },
        "audit": {
          "type": "object",
          "additionalProperties": false,
          "properties": {
            "scope": {
              "type": "string",
              "enum": ["repository", "changed-files"],
              "default": "repository"
            },
            "includeHistory": {
              "type": "boolean",
              "default": false
            },
            "failOn": {
              "type": "array",
              "items": {
                "type": "string",
                "enum": ["info", "low", "medium", "high", "critical"]
              }
            }
          }
        },
        "baseline": {
          "type": "object",
          "additionalProperties": false,
          "properties": {
            "scope": {
              "type": "string",
              "enum": ["repository"],
              "default": "repository"
            },
            "writeBaseline": {
              "type": "boolean",
              "default": true
            }
          }
        }
      }
    },
    "scanners": {
      "type": "object",
      "additionalProperties": false,
      "properties": {
        "secrets": {
          "type": "object",
          "additionalProperties": false,
          "properties": {
            "patterns": {
              "type": "boolean",
              "default": true
            },
            "entropy": {
              "type": "boolean",
              "default": true
            },
            "entropyThreshold": {
              "type": "number",
              "minimum": 0,
              "maximum": 8,
              "default": 4.5
            },
            "customPatterns": {
              "type": "array",
              "items": {
                "type": "object",
                "additionalProperties": false,
                "required": ["id", "title", "regex", "severity"],
                "properties": {
                  "id": { "type": "string" },
                  "title": { "type": "string" },
                  "regex": { "type": "string" },
                  "severity": {
                    "type": "string",
                    "enum": ["info", "low", "medium", "high", "critical"]
                  },
                  "pathRegex": { "type": "string" }
                }
              }
            }
          }
        },
        "ast": {
          "type": "object",
          "additionalProperties": false,
          "properties": {
            "enabled": {
              "type": "boolean",
              "default": true
            },
            "languages": {
              "type": "array",
              "items": {
                "type": "string",
                "enum": ["javascript", "typescript", "python"]
              }
            }
          }
        }
      }
    },
    "compliance": {
      "type": "object",
      "additionalProperties": false,
      "properties": {
        "profiles": {
          "type": "array",
          "items": {
            "type": "string",
            "enum": ["BIO2", "NORA", "ISO27001", "NIST-CSF", "OWASP", "EU-AI-ACT", "AVG", "GDPR"]
          }
        },
        "evidenceLevel": {
          "type": "string",
          "enum": ["summary", "detailed", "audit-ready"],
          "default": "summary"
        }
      }
    },
    "output": {
      "type": "object",
      "additionalProperties": false,
      "properties": {
        "formats": {
          "type": "array",
          "items": {
            "type": "string",
            "enum": ["json", "sarif", "summary", "markdown", "compliance-markdown", "compliance-json"]
          }
        },
        "includeComplianceMapping": {
          "type": "boolean",
          "default": false
        }
      }
    }
  }
}
